serial_no,paper_id,title,authors,forum
30,30,Exploiting Unlabeled Data to Improve Detection of Visual Anomalies in Soft Fruits,"Taeyeong Choi,Xin Liu",WGBHIs3ugm
25,25,Data driven ensemble learning for soybean yield prediction,"Souradeep Chattopadhyay,Matthew Carroll,Baskar Ganapathysubramanian,Asheesh K Singh,Soumik Sarkar",vrXKC3eYMU
23,23,Towards Autonomous Apple Fruitlet Sizing with Next Best View Planning,"Harry Freeman,George Kantor",DcHdI9-gK3
20,20,Zero-Shot Insect Detection via Weak Language Supervision,"Benjamin Feuer,Ameya Joshi,Minsu Cho,Kewal Jani,Shivani Chiranjeevi,ZI Kang Deng,Aditya Balu,Asheesh K Singh,Soumik Sarkar,Nirav Merchant,Arti Singh,Baskar Ganapathysubramanian,Chinmay Hegde",VPDKe672pv
19,19,LiT Tuned Models for Efficient Species Detection,"Andre Nakkab,Benjamin Feuer,Chinmay Hegde",sZlKXXWJlA
17,17,Transfer Learning with Pairwise Comparison for Fine-Granular Fruit Shelf-Life Prediction,"Jayita Dutta,Manasi Patwardhan,Parijat Deshpande,Beena Rai",d14vdxFbsSh
16,16,DeepOryza: A Knowledge guided machine learning model for rice growth simulation,"Jingye Han,Liangsheng Shi,Christos Pylianidis,Qi Yang,Ioannis N. Athanasiadis",L9ankU4Ge-v
13,13,A New Dataset and Comparative Study for Aphid Cluster Detection,"Tianxiao Zhang,Kaidong Li,Xiangyu Chen,Cuncong Zhong,Bo Luo,Ivan Grijalva Teran,Brian McCornack,Daniel Flippo,Ajay Sharda,Guanghui Wang",BuQ50s9ces
12,12,Tomato-plant Sunlit-leaf Segmentation Using Convolutional Neural Networks: Supporting Crop Water Stress Index Measurements,"Jacob Hampton,Aris Athanasios Panagopoulos,Minas Pantelidakis,Eric Kor,Konstantinos Mykoniatis,Orestis P. Panagopoulos,Shawn Ashkan",_GJvOvRvjiC
08,8,Learning Crop Management by Reinforcement: gym-DSSAT,"romain gautron,Emilio J. Padrón,Philippe Preux,julien bigot,Odalric-Ambrym Maillard,Gerrit Hoogenboom,julien teigny",4vNeWNQc3U
06,6,Farm-gym: A modular reinforcement learning platform for stochastic agronomic games,"Odalric-Ambrym Maillard,Timothée Mathieu,Debabrota Basu",Ev4NOEeTYL
03,3,Quality Control in Weather Monitoring with Dynamic Linear Models,"Joel Janek Dabrowski,Ashfaqur Rahman,Ming Li,Quanxi Shao,Shuvo Bakar,Andrea Powell,Brent Henderson",OP7Mq-z9SZ-
32,32,Plant Geometry Reconstruction From Field Data Using Neural Radiance Fields,"Anushrut Jignasu,Ethan Herron,Talukder Zaki Jubery,James Afful,Aditya Balu,Baskar Ganapathysubramanian,Soumik Sarkar,Adarsh Krishnamurthy",TvKKqWn_-6
31,31,Optimized Class-specific Data Augmentation for Plant Stress Classification,"Nasla Saleem,Baskar Ganapathysubramanian,Aditya Balu,Talukder Zaki Jubery,Soumik Sarkar,Arti Singh,Asheesh K Singh",kPM87uCwFq
29,29,Persistence Homology to Study Cold Hardiness of Grape Cultivars,"Sejal Welankar,Paola Gabriela Pesantez,Bala Krishnamoorthy,Ananth Kalyanaraman",PPoe26Ys-j
28,28,Out-of-distribution algorithms for robust insect classification,"Mojdeh Saadati,Shivani Chiranjeevi,Aditya Balu,Talukder Zaki Jubery,Asheesh K Singh,Soumik Sarkar,Arti Singh,Baskar Ganapathysubramanian",39Eh1ifhsj
27,27,Intelligent Drought Stress Monitoring on Spatio-Spectral-Temporal Drone based Crop Imagery using Deep Networks,"Tejasri N,Rajalakshmi Pachamuthu,Balaji Naik,Uday B Desai",6U08SGo64_
24,24,2-D HISTOGRAM BASED ON RELATIVE ENTROPY THRESHOLDING FOR CROP SEGMENTATION USING UAV-BASED IMAGES,"Gattu Priyanka,P Rajalakshmi,Jana Kholova",yFOhLRYRj_
22,22,Constrained Reinforcement Learning for Autonomous Farming: Challenges and Opportunities,"Yongshuai Liu,Taeyeong Choi,Xin Liu",BVkzFyB-dv
21,21,Multi Task Learning for Budbreak Prediction,"Aseem Saxena,Paola Gabriela Pesantez,Rohan Ballapragada,Markus Keller,Alan Fern",kvGm8DJ-cM
18,18,Univariate and multivariate time-series methods to forecast dairy income,"Vahid Naghashi,Gabriel Machado Dallago,Abdoulaye Banire Diallo,Mounir Boukadoum",0sGHJV7tRM
15,15,A Reflection on AI Model Selection for Digital Agriculture Image Datasets,"Seth Ockerman,John Wu,Christopher Stewart,Zitchen Zhang",vBSUoUuAYOA
10,10,Semi-Automated Construction of Food Composition Knowledge Base,"Jason Youn,Fangzhou Li,Ilias Tagkopoulos",4I7WLDmseD
07,7,Soft Robotic End-Effectors in the Wild: A Case Study of a Soft Manipulator for Green Bell Pepper Harvesting,"Dominik Bauer,Cornelia Bauer,Nancy Pollard",SmiDAiT6Goh
05,5,Dual phase convolutional neural network based system aimed at small rice grain dataset for disease identification,"Tashin Ahmed,Chowdhury Rafeed Rahman,Md. Faysal Mahmud Abid",EXV_d6ECUTa
02,2,Semi-Supervised Object Detection for Agriculture,"Gabriel Tseng,Krisztina Sinkovics,Tom Watsham,David Rolnick,Thomas C. Walters",AR4SAOzcuz